{
  "run_id": "heller-mesh-synthetic-001",
  "scenario": "packaging-education-release",
  "as_of": "2026-05-05T00:00:00Z",
  "framework_version": "0.1.0",
  "sphere_states": [
    {
      "sphere_id": "security",
      "economic_profit": 12.0,
      "momentum": 0.62,
      "knowledge_quality": 0.74,
      "micro_supply": 300.0,
      "credit_supply": 4.0,
      "reserve_supply": 2.0,
      "risk_charge": 1.8,
      "capital_charge": 0.7
    },
    {
      "sphere_id": "dev",
      "economic_profit": 14.0,
      "momentum": 0.64,
      "knowledge_quality": 0.76,
      "micro_supply": 350.0,
      "credit_supply": 4.0,
      "reserve_supply": 2.1,
      "risk_charge": 1.0,
      "capital_charge": 0.5
    },
    {
      "sphere_id": "forensics",
      "economic_profit": 9.0,
      "momentum": 0.58,
      "knowledge_quality": 0.72,
      "micro_supply": 280.0,
      "credit_supply": 3.0,
      "reserve_supply": 1.6,
      "risk_charge": 1.5,
      "capital_charge": 0.4
    },
    {
      "sphere_id": "community",
      "economic_profit": 22.0,
      "momentum": 0.8,
      "knowledge_quality": 0.69,
      "micro_supply": 600.0,
      "credit_supply": 4.0,
      "reserve_supply": 1.5,
      "risk_charge": 0.6,
      "capital_charge": 0.2
    },
    {
      "sphere_id": "attestation",
      "economic_profit": 10.0,
      "momentum": 0.67,
      "knowledge_quality": 0.88,
      "micro_supply": 260.0,
      "credit_supply": 3.0,
      "reserve_supply": 1.8,
      "risk_charge": 0.8,
      "capital_charge": 0.5
    },
    {
      "sphere_id": "mesh",
      "economic_profit": 20.0,
      "momentum": 0.73,
      "knowledge_quality": 0.81,
      "micro_supply": 750.0,
      "credit_supply": 6.0,
      "reserve_supply": 3.2,
      "risk_charge": 1.0,
      "capital_charge": 0.8
    },
    {
      "sphere_id": "champion",
      "economic_profit": 8.0,
      "momentum": 0.56,
      "knowledge_quality": 0.7,
      "micro_supply": 240.0,
      "credit_supply": 3.0,
      "reserve_supply": 1.1,
      "risk_charge": 0.7,
      "capital_charge": 0.2
    },
    {
      "sphere_id": "packaging",
      "economic_profit": 18.0,
      "momentum": 0.71,
      "knowledge_quality": 0.82,
      "micro_supply": 420.0,
      "credit_supply": 5.0,
      "reserve_supply": 2.4,
      "risk_charge": 1.2,
      "capital_charge": 0.6
    },
    {
      "sphere_id": "education",
      "economic_profit": 25.0,
      "momentum": 0.77,
      "knowledge_quality": 0.91,
      "micro_supply": 520.0,
      "credit_supply": 2.0,
      "reserve_supply": 1.2,
      "risk_charge": 0.5,
      "capital_charge": 0.2
    },
    {
      "sphere_id": "federation",
      "economic_profit": 13.0,
      "momentum": 0.61,
      "knowledge_quality": 0.78,
      "micro_supply": 360.0,
      "credit_supply": 4.0,
      "reserve_supply": 2.3,
      "risk_charge": 0.9,
      "capital_charge": 0.6
    },
    {
      "sphere_id": "governance",
      "economic_profit": 7.0,
      "momentum": 0.55,
      "knowledge_quality": 0.79,
      "micro_supply": 180.0,
      "credit_supply": 2.0,
      "reserve_supply": 5.0,
      "risk_charge": 0.4,
      "capital_charge": 0.3
    }
  ],
  "edge_measurements": [
    {
      "source_sphere_id": "packaging",
      "target_sphere_id": "education",
      "delta_ep": 10.0,
      "knowledge_quality": 0.4032,
      "transfer_price": 6.532,
      "credit_exposure": 1.0,
      "required_collateral": 0.2,
      "pending_settlement_risk": 0.0,
      "dispute_reserve": 0.0,
      "chargeback_reserve": 0.0,
      "rights_warranty_reserve": 0.0,
      "operational_risk_charge": 0.0,
      "concentration_charge": 0.0
    },
    {
      "source_sphere_id": "attestation",
      "target_sphere_id": "packaging",
      "delta_ep": 4.0,
      "knowledge_quality": 0.88,
      "transfer_price": 2.95,
      "credit_exposure": 0.5,
      "required_collateral": 0.12,
      "pending_settlement_risk": 0.02,
      "dispute_reserve": 0.0,
      "chargeback_reserve": 0.0,
      "rights_warranty_reserve": 0.0,
      "operational_risk_charge": 0.03,
      "concentration_charge": 0.0
    },
    {
      "source_sphere_id": "mesh",
      "target_sphere_id": "community",
      "delta_ep": 6.0,
      "knowledge_quality": 0.81,
      "transfer_price": 4.15,
      "credit_exposure": 0.7,
      "required_collateral": 0.15,
      "pending_settlement_risk": 0.03,
      "dispute_reserve": 0.0,
      "chargeback_reserve": 0.0,
      "rights_warranty_reserve": 0.0,
      "operational_risk_charge": 0.04,
      "concentration_charge": 0.0
    },
    {
      "source_sphere_id": "security",
      "target_sphere_id": "forensics",
      "delta_ep": 3.0,
      "knowledge_quality": 0.74,
      "transfer_price": 2.35,
      "credit_exposure": 0.8,
      "required_collateral": 0.2,
      "pending_settlement_risk": 0.02,
      "dispute_reserve": 0.01,
      "chargeback_reserve": 0.0,
      "rights_warranty_reserve": 0.0,
      "operational_risk_charge": 0.05,
      "concentration_charge": 0.01
    },
    {
      "source_sphere_id": "governance",
      "target_sphere_id": "federation",
      "delta_ep": 2.0,
      "knowledge_quality": 0.79,
      "transfer_price": 1.72,
      "credit_exposure": 0.6,
      "required_collateral": 0.1,
      "pending_settlement_risk": 0.01,
      "dispute_reserve": 0.0,
      "chargeback_reserve": 0.0,
      "rights_warranty_reserve": 0.0,
      "operational_risk_charge": 0.02,
      "concentration_charge": 0.0
    },
    {
      "source_sphere_id": "community",
      "target_sphere_id": "education",
      "delta_ep": 5.0,
      "knowledge_quality": 0.69,
      "transfer_price": 3.48,
      "credit_exposure": 0.4,
      "required_collateral": 0.08,
      "pending_settlement_risk": 0.01,
      "dispute_reserve": 0.0,
      "chargeback_reserve": 0.0,
      "rights_warranty_reserve": 0.0,
      "operational_risk_charge": 0.02,
      "concentration_charge": 0.0
    }
  ],
  "triparty_faces": [
    {
      "face_id": "face-packaging-attestation-education-001",
      "parties": ["packaging", "attestation", "education"],
      "lambda_evid": 1.0,
      "lambda_admit": 1.0,
      "lambda_release": 0.8,
      "residual": 0.2,
      "state": "Released",
      "visibility_state": "RestrictedProof",
      "proof_artifact_id": "proof-heller-mesh-synthetic-001"
    },
    {
      "face_id": "face-security-forensics-packaging-001",
      "parties": ["security", "forensics", "packaging"],
      "lambda_evid": 0.8,
      "lambda_admit": 0.6,
      "lambda_release": 0.5,
      "residual": 0.3,
      "state": "Verified",
      "visibility_state": "ReviewOnly",
      "proof_artifact_id": "proof-security-forensics-packaging-001"
    }
  ],
  "heller_supply": {
    "micro": 4260.0,
    "credit": 40.0,
    "reserve": 24.2
  },
  "reserve_adequacy": 28.470588235294116,
  "credit_utilization": 0.1,
  "gross_to_net_compression": 0.7222222222222223,
  "release_correctness": 1.0,
  "refund_safety": 1.0,
  "contradiction_containment": 1.0,
  "export_discipline": 1.0,
  "replay_completeness": 1.0
}
